{
  "id": "bree_villager",
  "race": "man",
  "faction": "bree",
  "tier": "standard",
  "voice": "Blunt Bree-landers' speech, a little rustic: 'Eh', 'ye', 'I reckon', 'we don't hold with that'. Suspicious of Rangers and strangers from the South, curious about travellers' news. Hospitable to paying folk.",
  "name_pool": [
    "Harry Goatleaf",
    "Ted Sandheaver",
    "Old Noakes",
    "Nick Lumberby",
    "Dunstan Underhill",
    "Bert Appledore",
    "Hob Mugwort",
    "Willem Dunhill",
    "Edda Marshfield",
    "Cob Ferny",
    "Brant Thistle",
    "Gilly Nettlebed",
    "Hamon Pimm",
    "Joan Apple-garth",
    "Walt Whitfoot"
  ],
  "personality_pool": [
    "gruff",
    "nosy",
    "suspicious of Rangers",
    "hospitable",
    "proud of Bree",
    "superstitious",
    "talkative over a pint",
    "wary of the Southerners",
    "hardworking",
    "a gossip"
  ],
  "speech_samples": [
    "Aye, ye'll find the Pony's good for a bed and a bite. Barliman's a fine host, though forgetful.",
    "Rangers? Wanderers. Best leave 'em alone, I say.",
    "Strange folk about this autumn. Strange folk indeed, and none too friendly."
  ],
  "knowledge": [
    {
      "id": "bree_life",
      "fact": "Knows Bree-land: the four villages (Bree, Staddle, Combe, Archet), the Hill, the West-gate and South-gate, the Prancing Pony and its landlord Barliman Butterbur. Men and hobbits live side by side.",
      "known_from": "3018-01-01"
    },
    {
      "id": "strangers_road",
      "fact": "A number of dwarves, strange travellers and sallow Southerners have passed through Bree this year, and Rangers are seen more often than they used to be.",
      "known_from": "3018-09-01"
    },
    {
      "id": "gate_wardens",
      "fact": "The gate-wardens at the West-gate and South-gate shut the gates at dusk, and open them only for good reason.",
      "known_from": "3018-01-01"
    },
    {
      "id": "black_riders_road",
      "fact": "Odd black-cloaked riders have been reported on the road near Bree, and a few of the horses shy at them. Some say they were looking for something. [verify]",
      "known_from": "3018-09-26"
    },
    {
      "id": "black_riders_west_gate",
      "fact": "On the evening of Sept 29 black-cloaked riders came to the West-gate and forced the gatekeeper, Harry Goatleaf, to open to them. [verify]",
      "known_from": "3018-09-29T20:00",
      "requires_flag": "black_riders_entered_bree"
    },
    {
      "id": "pony_raid",
      "fact": "The Prancing Pony was broken into in the night: beds slashed, ponies stolen. Bree is in an uproar. [verify]",
      "known_from": "3018-09-30T06:00",
      "requires_flag": "pony_raided"
    },
    {
      "id": "hobbits_underhill",
      "fact": "A party of four hobbits calling themselves Underhill stayed at the Pony on the 29th and left suddenly the next morning, with the Ranger Strider. [verify]",
      "known_from": "3018-09-30T09:00",
      "requires_flag": "frodo_party_at_bree"
    }
  ],
  "never_knows": [
    "the Ring",
    "events outside Bree-land",
    "anything after the current date"
  ],
  "inventory_can_give": [
    "ale_mug",
    "bread_loaf",
    "apple",
    "dried_meat"
  ],
  "verify": true
}
